anuncio/propriedade,tipo,FREGUESIA,CONCELHO,DISTRITO,area(m²),valor renda(€/mes)
T3 mobilado com vista mar nos Jardins da Parede,Apartamento,CARCAVELOS,CASCAIS,LISBOA,120.0,2700
T2 DUPLEX SEM MÓVEIS EM ALCABIDECHE CENTRO,Apartamento,ALCABIDECHE,CASCAIS,LISBOA,137.0,1600
Apartamento duplex t1 totalmente remodelado no centro do ...,Apartamento,CEDOFEITA,PORTO,PORTO,57.0,1150
T3 Remodelado com boas áreas em excelente localização perto do metro,Apartamento,CEDOFEITA,PORTO,PORTO,140.0,1200
ARRENDAMENTO - Apartamento T3 com excelente vista Mar,Apartamento,ERICEIRA,MAFRA,LISBOA,124.0,2300
Apartamento T1 para arrendamento na Graça,Apartamento,SAO VICENTE,SAO VICENTE,LISBOA,59.0,1900
Apartamento T2 | Cascais,Apartamento,CASCAIS,CASCAIS,LISBOA,86.0,3100
Apartamento T2 para arrendamento na Ajuda,Apartamento,BELEM,LISBOA,LISBOA,70.0,2800
Apartamento T1 para arrendamento sem móveis em Santo António,Apartamento,SANTO ANTONIO,LISBOA,LISBOA,52.0,2050
"Para Arrendar | Apartamento T2 | Miraflores, Algés",Apartamento,ALGES,OEIRAS,LISBOA,70.69,1950
T3 Remodelado com boas áreas em excelente localização per...,Apartamento,CEDOFEITA,PORTO,PORTO,140.0,1200
"Para arrendar | Apartamento T4 | Bicuda, Cascais",Apartamento,CASCAIS,CASCAIS,LISBOA,170.0,4000
T3 totalmente renovado junto à Casa da Música,Apartamento,LORDELO DO OURO,PORTO,PORTO,95.0,2000
T3+1 em Canidelo,Apartamento,CANIDELO,VILA NOVA DE GAIA,PORTO,174.0,2500
"Apartamento T1 mobilado para arrendar, na Parede",Apartamento,CARCAVELOS,CASCAIS,LISBOA,55.0,1500
Apartamento T1 para arrendamento no centro de Cascais,Apartamento,CASCAIS,CASCAIS,LISBOA,96.0,2000
Excelente apartamento T1 Gaia.,Apartamento,MAFAMUDE,VILA NOVA DE GAIA,PORTO,84.0,1300
"Apartamento T2 Moderno Mobilado para arrendamento na Misericórdia,",Apartamento,MISERICORDIA,LISBOA,LISBOA,130.0,1780
Apartamento T3 Duplex - Quinta da Marinha.,Apartamento,CASCAIS,CASCAIS,LISBOA,201.0,8000
3 assoalhadas I Remodelado I  Lisboa,Apartamento,MISERICORDIA,LISBOA,LISBOA,138.0,2600
Para Arrendar | Moradia T5 com jardim | Cascais Centro,Moradia,CASCAIS,CASCAIS,LISBOA,220.0,8000
Apartamento T2 remodelado em Carnide/Lisboa,Apartamento,CARNIDE,LISBOA,LISBOA,65.0,1400
Moradia T4 para arrendamento,Moradia,CORROIOS,SEIXAL,SETUBAL,362.0,8000
Apartamento T3 remodelado em Carnide/Lisboa,Apartamento,CARNIDE,LISBOA,LISBOA,78.0,1600
Moradia T4 com vista mar para arrendamento na Praia Grande,Moradia,COLARES,SINTRA,LISBOA,220.0,6500
"Moradia Arrendar T5 Olhos Água, Albufeira",Moradia,ALBUFEIRA,ALBUFEIRA,FARO,350.0,8000
Moradia bi-familiar T4 sem móveis para arrendar em Leceia...,Moradia,BARCARENA,OEIRAS,LISBOA,145.0,2200
Apartamento T2 para arrendar com garagem e arrecadação no Estoril,Apartamento,CASCAIS,CASCAIS,LISBOA,91.0,1950
Apartamento T2 na costa da Guia com excelentes áreas e ga...,Apartamento,CASCAIS,CASCAIS,LISBOA,88.0,2000
"Apartamento T3 duplex sem móveis para arrendar, no Centro...",Apartamento,CASCAIS,CASCAIS,LISBOA,184.0,4000
"Apartamento T3 duplex sem móveis,inserido em condomínio f...",Apartamento,ALGES,OEIRAS,LISBOA,185.0,3450
"Vista total de mar -T4 em condomínio fechado , piscina, terraço e gina",Apartamento,CASCAIS,CASCAIS,LISBOA,210.0,8000
Apartamento T3 para arrendamento,Apartamento,ESTRELA,LISBOA,LISBOA,176.32,8000
"Apartamento T4 sem móveis para arrendar, novo a estrear, ...",Apartamento,CASCAIS,CASCAIS,LISBOA,235.0,7500
"Apartamento: T3+1 para arrendamento, sem móveis nas Avenidas Novas",Apartamento,AVENIDAS NOVAS,LISBOA,LISBOA,185.0,3950
Moradia isolada T6 no Estoril,Moradia,CASCAIS,CASCAIS,LISBOA,196.0,8000
Apartamento T2+2 em Ponte de Lima,Apartamento,ARCA,PONTE DE LIMA,VIANA DO CASTELO,58.0,650
"Moradia T7+1 com vista mar, jardim e piscina, em Oeiras",Moradia,OEIRAS,OEIRAS,LISBOA,409.0,7900
Moradia Cond.Fechado Ericeira V4 Equipada C\Box e Arrecadação,Moradia,ERICEIRA,MAFRA,LISBOA,140.0,2490
Apartamento T2 na Av EUA em Lisboa,Apartamento,ALVALADE,LISBOA,LISBOA,89.5,1450
T3 EM CONDOMÍNIO DE LUXO EM BENFICA,Apartamento,BENFICA,LISBOA,LISBOA,153.0,5500
T4 Duplex Porto,Apartamento,PARANHOS,PORTO,PORTO,139.0,2600
"Casa de Campo T3 em Setúbal de 108,00 m2",Moradia,QUINTA DO ANJO,PALMELA,SETUBAL,108.0,1500
"Apartamento T4 em Porto de 138,00 m2",Apartamento,CEDOFEITA,PORTO,PORTO,138.0,1350
"Estoril- Quinta da Graciosa - Excelente T2 Condomínio, se...",Apartamento,CASCAIS,CASCAIS,LISBOA,125.0,1850
"Moradia T4 mobilada, nova a estrear em Porto Salvo, com p...",Moradia,PORTO SALVO,OEIRAS,LISBOA,200.0,7600
À Graça | T3. 120m2. Garagem e arrecadação. Pronto habitar,Apartamento,SAO VICENTE,SAO VICENTE,LISBOA,110.0,1650
Apartamento T1 novo para arrendamento junto à Universidade de Aveiro,Apartamento,GLORIA,AVEIRO,AVEIRO,70.3,1350
"Apartamento T2 semi-novo, mobilado e equipado, no último piso dos Terr",Apartamento,SANTO ANTONIO DOS OLIVAIS,COIMBRA,COIMBRA,92.0,1750
"REF0086 T3 de Luxo C/Mobília Damião de Góis /Centro do Porto, Paranhos",Apartamento,CEDOFEITA,PORTO,PORTO,148.0,1800
Excelente T1 mobilado no 'Prata Riverside Village',Apartamento,MARVILA,LISBOA,LISBOA,63.1,1750
"Apartamento T2 Duplex para arrendar sem móveis, em Campo de Ourique",Apartamento,CAMPO DE OURIQUE,LISBOA,LISBOA,50.0,1650
"T4 Graça, Remodelado, Cozinha equipada, prédio com 2 elev...",Apartamento,SAO VICENTE,SAO VICENTE,LISBOA,120.0,2550
Fabuloso apartamento T4 em Alvalade,Apartamento,ALVALADE,LISBOA,LISBOA,171.0,2100
"Apartamento T2 MOBILADO na zona das Amoreiras, LISBOA",Apartamento,CAMPOLIDE,LISBOA,LISBOA,94.0,2000
"Apartamento T1 em Lisboa de 102,00 m2",Apartamento,ALVALADE,LISBOA,LISBOA,102.0,1750
Moradia T4+1 para arrendamento no prestigiado Bairro do Rosário,Moradia,CASCAIS,CASCAIS,LISBOA,299.0,7500
Apartamento T2 com varanda e garagem - Coimbra,Apartamento,SANTA CLARA,COIMBRA,COIMBRA,110.0,1300
"Moradia T3 com jardim e garagem, perto da praia de São Pe...",Moradia,CASCAIS,CASCAIS,LISBOA,147.0,4500
"Apartamento T1 com estacionamento, terraço e WIFI em Altu...",Apartamento,ALTURA,CASTRO MARIM,FARO,67.2,650
Moradia de charme T4 em Cascais numa localização prime.,Moradia,CASCAIS,CASCAIS,LISBOA,270.0,7500
"Apartamento T2 de Luxo para arrendamento, em Campolide (NOVO)",Apartamento,CAMPOLIDE,LISBOA,LISBOA,90.0,7500
Apartamento T3 no one Living em Cascais,Apartamento,CASCAIS,CASCAIS,LISBOA,187.0,7500
Moradia T4 para arrendamento,Moradia,CHARNECA DE CAPARICA,ALMADA,SETUBAL,180.0,7500
Moradia T4 para arrendamento,Moradia,CASCAIS,CASCAIS,LISBOA,260.0,7500
APARTAMENTO DE COM 368M2 COM 4 LUGARES DE GARAGEM PISO UNICO,Apartamento,ALVALADE,LISBOA,LISBOA,284.0,7500
Apartamento T3 Amoreiras TORRE | Arrendar - Renovado c/ e...,Apartamento,CAMPOLIDE,LISBOA,LISBOA,190.0,7500
"Apartamento T3+1 para arrendamento, sem móveis nas Avenidas Novas",Apartamento,AVENIDAS NOVAS,LISBOA,LISBOA,225.0,4500
Apartamento T3 para arrendamento em Fátima,Apartamento,FATIMA,OUREM,SANTAREM,123.5,800
"Apartamento T1 mobilado e equipado,com estacionamento privativo no cen",Apartamento,SANTO ANTONIO DOS OLIVAIS,COIMBRA,COIMBRA,55.0,650
T1 Novo Último Piso c/ Vistas Rio na Afurada (Marina),Apartamento,SANTA MARINHA,VILA NOVA DE GAIA,PORTO,91.0,1500
T2 Novo c/ Vistas Rio na Afurada (Marina),Apartamento,SANTA MARINHA,VILA NOVA DE GAIA,PORTO,122.0,1980
"Apartamento T3 em Braga de 111,00 m2",Apartamento,BRAGA,SE,BRAGA,111.0,1700
"Moradia T2, no Bom Sucesso Resort, Óbidos",Moradia,VAU,OBIDOS,LEIRIA,100.0,2000
Apartamento T2 no condomínio Cascais Park,Apartamento,CASCAIS,CASCAIS,LISBOA,123.5,2800
Encantador T1 Duplex na Torre de S. Rafael,Apartamento,PARQUE DAS NACOES,LISBOA,LISBOA,94.0,2500
Apartamento T3 com piscina privativa e 2 estacionamentos ...,Apartamento,AREEIRO,LISBOA,LISBOA,166.0,5950
"Apartamento T2+1 para arrendamento, sem móveis em Santa Maria Maior",Apartamento,SANTA MARIA MAIOR,LISBOA,LISBOA,143.28,3200
Excelente apartamento mobilado T3 em Canidelo com vistas Foz do Douro,Apartamento,CANIDELO,VILA NOVA DE GAIA,PORTO,126.8,1800
Apartamento T3+1 a 200m do mar,Apartamento,CASCAIS,CASCAIS,LISBOA,184.64,4000
Apartamento T3 em Matosinhos remodelado com suíte e garagem,Apartamento,MATOSINHOS,MATOSINHOS,PORTO,120.0,1700
Luxuoso Apartamento T3 - Condomínio Fechado no Centro do ...,Apartamento,CASCAIS,CASCAIS,LISBOA,138.0,4950
"Apartamento, 195 m², Matosinhos e Leça da Palmeira",Apartamento,MATOSINHOS,MATOSINHOS,PORTO,195.0,3200
Apartamento T1 em Condomínio Fechado na Boavista,Apartamento,CEDOFEITA,PORTO,PORTO,74.0,1200
Apartamento T2 próximo da Estrada da Luz,Apartamento,SAO DOMINGOS DE BENFICA,LISBOA,LISBOA,65.0,1300
Apartamento T2 com 85m2 em prédio com elevador em Benfica,Apartamento,BENFICA,LISBOA,LISBOA,85.0,1350
Apartamento T2 com terraço e garagem individual,Apartamento,SAO VICTOR,SAO VICTOR,BRAGA,90.0,1100
Apartamento T2 para arrendamento,Apartamento,ALTO DO SEIXALINHO,BARREIRO,SETUBAL,55.0,900
"Apartamento T0 a estrear, nas Avenidas Novas, Lisboa",Apartamento,AVENIDAS NOVAS,LISBOA,LISBOA,35.0,1500
T1 para arrendamento | Monte Abraão,Apartamento,MASSAMA,SINTRA,LISBOA,43.0,980
Apartamento T2 para arrendamento,Apartamento,ESPINHO,ESPINHO,AVEIRO,72.0,1200
T2 - Andar Moradia em Mafamude - perto da linha do metro,Moradia,MAFAMUDE,VILA NOVA DE GAIA,PORTO,70.0,860
"Moradia renovada com alpendre e terreno, Vilarinho do Bairro, Anadia",Moradia,VILARINHO DO BAIRRO,ANADIA,AVEIRO,110.0,800
Ericeira - S. Lourenço - T2 duplex com piscina em cima da...,Apartamento,ERICEIRA,MAFRA,LISBOA,80.0,1280
T5 Frente ao mar - Póvoa de Varzim,Apartamento,POVOA DE VARZIM,POVOA DE VARZIM,PORTO,240.0,1500
Apartamento T3 com garagem e arrecadação perto da Estação...,Apartamento,BENFICA,LISBOA,LISBOA,146.0,2200
"T2Quarteira c/ garagem, arrenda-se período fixo (agora-junho2024)",Moradia,QUARTEIRA,LOULE,FARO,1111.0,950
Apartamento T3 para Arrendamento em Condomínio Privado no Monte do Est,Apartamento,CASCAIS,CASCAIS,LISBOA,172.0,7000
Apartamento T3 novo de arquitectura contemporânea na Lapa...,Apartamento,ESTRELA,LISBOA,LISBOA,180.0,7000
Moradia V5 Recuperada e Mobilada em Cascais,Moradia,ALCABIDECHE,CASCAIS,LISBOA,242.6,4950
Apartamento T2 com varanda para arrendamento no Monte Estoril,Apartamento,CASCAIS,CASCAIS,LISBOA,55.0,1400
Apartamento T1 para Arrendar em Marvila - Prata Riverside...,Apartamento,MARVILA,LISBOA,LISBOA,40.3,1550
"Apartamento T1 - Lisboa, Campolide.",Apartamento,CAMPOLIDE,LISBOA,LISBOA,53.0,1500
APARTAMENTO T2 MONTE DO ESTORIL COM VISTA PARA POENTE,Apartamento,CASCAIS,CASCAIS,LISBOA,143.0,2900
Moradia Geminada T3 + 1 - Alcabideche,Moradia,ALCABIDECHE,CASCAIS,LISBOA,200.0,6500
Apartamento T3 em Carnaxide,Apartamento,CARNAXIDE,OEIRAS,LISBOA,141.0,2500
Apartamento T1 com bonitas vistas de Rio,Apartamento,CEDOFEITA,PORTO,PORTO,58.0,1100
Estúdio T0 Arrendar Mobilado e Equipado Praça da Republica - Porto,Apartamento,CEDOFEITA,PORTO,PORTO,33.0,1000
Moradia T3 geminada para arrendamento em Benfica,Moradia,BENFICA,LISBOA,LISBOA,108.0,3000
Apartamento T2 para arrendamento com móveis na Misericórdia,Apartamento,MISERICORDIA,LISBOA,LISBOA,85.0,1600
Apartamento T3 - Cascais.,Apartamento,CASCAIS,CASCAIS,LISBOA,97.0,2200
"Apartamento T3 com vista mar, no centro de Cascais",Apartamento,CASCAIS,CASCAIS,LISBOA,150.0,3500
T2 para arrendar Mobilado e Equipado Matosinhos Sul,Apartamento,MATOSINHOS,MATOSINHOS,PORTO,93.0,2100
Magnífica Moradia T4 em Magoito num Condomínio Fechado,Moradia,SAO JOAO DAS LAMPAS,SINTRA,LISBOA,221.0,2973
Apartamento T1 na Baia de Cascais,Apartamento,CASCAIS,CASCAIS,LISBOA,57.0,2500
Moradia T2 nova a estrear para arrendamento em Alcantarilha,Moradia,ALCANTARILHA,SILVES,FARO,97.0,2500
Moradia T3 para arrendamento,Moradia,CHARNECA DE CAPARICA,ALMADA,SETUBAL,342.0,7000
Apartamento T2+1 no centro de Rio Tinto com varanda e garagem,Apartamento,RIO TINTO,GONDOMAR,PORTO,110.0,1425
Moradia T5 com Terraço e  apartamento T1 independente,Moradia,SANTO ANTONIO,LISBOA,LISBOA,374.0,7000
Apartamento T2+1 no centro de Rio Tinto com varanda e gar...,Apartamento,RIO TINTO,GONDOMAR,PORTO,110.0,1425
T4 com 4 suítes - luxo contemporâneo em condomínio privad...,Apartamento,SAO VICENTE,SAO VICENTE,LISBOA,240.0,7000
Apartamento com 218 m2 remodelado a estrear,Apartamento,SAO DOMINGOS DE BENFICA,LISBOA,LISBOA,165.2,3500
Apartamento T4 Duplex mobilado e equipado- Gaia,Apartamento,MAFAMUDE,VILA NOVA DE GAIA,PORTO,209.0,2850
"Apartamento T1, mobilado e equipado, junto ao El Corte In...",Apartamento,MAFAMUDE,VILA NOVA DE GAIA,PORTO,85.4,1300
Apartamento T2 para arrendamento em Alcantara,Apartamento,ALCANTARA,LISBOA,LISBOA,115.0,3500
ARRENDA | T3 Av. Roma | Varanda + Parqueamento + Elevador | Remodelado,Apartamento,ALVALADE,LISBOA,LISBOA,120.0,2150
Apartamento T7 para arrendamento,Apartamento,SANTO ANTONIO,LISBOA,LISBOA,215.0,7000
ARRENDA T3 Av. Roma | Com Varanda + Box + Elevador|Remodelado (165m2),Apartamento,ALVALADE,LISBOA,LISBOA,120.0,2250
Apartamento T3 para arrendamento,Apartamento,SANTO ANTONIO,LISBOA,LISBOA,90.0,7000
"T3+1 Frente à praia do Molhe | Av. Brasil - Foz | Renovado, parcialmen",Apartamento,ALDOAR,PORTO,PORTO,150.0,2900
Apartamento T2 em Condomínio a 2 Minutos da Praia e do Ce...,Apartamento,ERICEIRA,MAFRA,LISBOA,82.0,1600
Moradia T5 no Alto do Lagoal com vista frontal de mar,Moradia,OEIRAS,OEIRAS,LISBOA,366.0,7000
T3 em frente ao mar,Apartamento,MADALENA,VILA NOVA DE GAIA,PORTO,169.0,3000
Moradia T7 para arrendamento,Moradia,ALBUFEIRA,ALBUFEIRA,FARO,663.0,7000
Apartamento T2 no coração do Chiado com elevador,Apartamento,SANTA MARIA MAIOR,LISBOA,LISBOA,107.0,2500
"Apartamento T2 , com garagem, Avenidas Novas, Lisboa",Apartamento,CAMPOLIDE,LISBOA,LISBOA,90.0,3100
T3 flat for rent in rua Fernão Lopes,Apartamento,ARROIOS,LISBOA,LISBOA,221.0,7000
Moradia T4 para arrendamento,Moradia,ALCABIDECHE,CASCAIS,LISBOA,207.0,6900
Campolide | T0 renovado  c/ mezzanine e terraço com despesas incluídas,Apartamento,CAMPOLIDE,LISBOA,LISBOA,40.0,1300
Campolide | T0 c/ mezzanine totalmente renovado com despesas incluídas,Apartamento,CAMPOLIDE,LISBOA,LISBOA,40.0,1100
Apartamento T3 - Arrendar,Apartamento,SANTAREM,SANTAREM,SANTAREM,96.02,900
Excelente Apartamento T1 junto á casa da musica,Apartamento,LORDELO DO OURO,PORTO,PORTO,44.0,1200
"Apartamento t3 na Quinta da Ouriva, Portimão",Apartamento,PORTIMAO,PORTIMAO,FARO,106.0,950
T3 na Quinta do Lambert com estacionamento!!,Apartamento,LUMIAR,LISBOA,LISBOA,106.4,2000
Apartamento T3 proximo centro Paredes,Apartamento,PAREDES,PAREDES,PORTO,106.0,750
"STUDIO junto Hosp Luz, centro comercial Colombo e metro",Apartamento,BENFICA,LISBOA,LISBOA,18.0,965
"Estudio Lgº 1º ten João Rodrigues Moura, metro Olivais",Apartamento,OLIVAIS,LISBOA,LISBOA,18.0,995
T2 mobilado para arrendar junto à Praça de Espanha,Apartamento,AVENIDAS NOVAS,LISBOA,LISBOA,52.0,1200
Apartamento T2 para arrendamento,Apartamento,MOSCAVIDE,LOURES,LISBOA,61.0,1200
Arrendo T2 Sintra,Apartamento,RIO DE MOURO,SINTRA,LISBOA,120.0,1300
Encantador apartamento com 3 quartos,Apartamento,CARCAVELOS,CASCAIS,LISBOA,150.0,2750
Apartamento T4 Arrendamento Cascais,Apartamento,CASCAIS,CASCAIS,LISBOA,185.0,5200
Apartamento T2 | Carnaxide,Apartamento,CARNAXIDE,OEIRAS,LISBOA,85.0,1500
Apartamento T0 para arrendamento,Apartamento,PARANHOS,PORTO,PORTO,39.0,900
"partamento T2 sem móveis para arrendar, novo a estrear em...",Apartamento,ALGES,OEIRAS,LISBOA,103.0,1950
T2 | El Corte Inglês | Renovado | Mobilado e Equipado | M...,Apartamento,MAFAMUDE,VILA NOVA DE GAIA,PORTO,100.0,1400
T2 | Condomínio Fechado | Mobilado e Equipado | Terraço | MaiaGest,Apartamento,SANTA MARINHA,VILA NOVA DE GAIA,PORTO,105.0,1900
T3 | Penthouse | Paço do Rei | Mobilado | Equipado | MaiaGest,Apartamento,MAFAMUDE,VILA NOVA DE GAIA,PORTO,130.0,2200
T2 | Mafamude | Garagem | Cozinha Equipada | MaiaGest,Apartamento,MAFAMUDE,VILA NOVA DE GAIA,PORTO,95.0,1350
T3 | Duplex | Cozinha Equipada | Varanda | MaiaGest,Apartamento,CEDOFEITA,PORTO,PORTO,73.0,1600
"Apartamento T2 | Baixa, Lisboa",Apartamento,SANTA MARIA MAIOR,LISBOA,LISBOA,81.0,3000
Apartamento T3 para arrendamento,Apartamento,CASCAIS,CASCAIS,LISBOA,167.0,3200
Apartamento T1 para arrendamento com estacionamento no Monte Estoril,Apartamento,CASCAIS,CASCAIS,LISBOA,79.0,1800
Apartamento T2 mobilado para arrendamento em Campolide,Apartamento,CAMPOLIDE,LISBOA,LISBOA,109.2,2250
Apartamento T4 para arrendamento no Chiado,Apartamento,SANTA MARIA MAIOR,LISBOA,LISBOA,201.0,4800
Moradia T4 para arrendamento em condomínio com piscina em  Cascais,Moradia,CASCAIS,CASCAIS,LISBOA,212.0,5000
"Apartamento T3 | Vistas Panorâmicas | Santa Marinha, V.N....",Apartamento,SANTA MARINHA,VILA NOVA DE GAIA,PORTO,138.0,2450
"Apartamento T3 sem móveis para arrendar, novo a estrear e...",Apartamento,ALGES,OEIRAS,LISBOA,161.0,2950
"Apartamento T1 em Lisboa de 71,00 m2",Apartamento,LUMIAR,LISBOA,LISBOA,71.0,1600
Moradia T6 para arrendamento,Moradia,CASCAIS,CASCAIS,LISBOA,316.0,6900
"Casa T4 em Lisboa de 350,00 m2",Moradia,ALCABIDECHE,CASCAIS,LISBOA,350.0,6900
Moradia T4+1 com jardim em Cascais,Moradia,CASCAIS,CASCAIS,LISBOA,315.0,6900
"Apartamento Penthouse T3 mobilado com varanda , vista e g...",Apartamento,ESTRELA,LISBOA,LISBOA,279.0,6800
Excelente Apartamento T3 com Terraço em Condomínio com Pi...,Apartamento,CASCAIS,CASCAIS,LISBOA,230.0,6800
Magnifico apartamentoT3 sem móveis para arrendar em Casca...,Apartamento,CASCAIS,CASCAIS,LISBOA,229.0,6800
T3 com terraço - Quinta  da Gandarinha,Apartamento,CASCAIS,CASCAIS,LISBOA,230.0,6800
"Moradia T6+1 - Birre, Cascais",Moradia,CASCAIS,CASCAIS,LISBOA,330.0,6600
"Moradia V5 de luxo a estrear Manique de Baixo, Alcabideche",Moradia,ALCABIDECHE,CASCAIS,LISBOA,238.0,6500
Pavilhões Industriais - Trofa,Apartamento,BOUGADO,TROFA,PORTO,1000.0,2400
Apartamento T3 Duplex em Vilar,Apartamento,GLORIA,AVEIRO,AVEIRO,117.0,850
Apartamento T3 no Centro de Cascais,Apartamento,CASCAIS,CASCAIS,LISBOA,130.0,4500
T2-R/C em Moradia Geminada | 2 Quartos+1 Sala+1 Cozinha+1 WC+1 Varanda,Moradia,CARNAXIDE,OEIRAS,LISBOA,140.0,1200
Apartamento T3 - AMORA,Apartamento,AMORA,SEIXAL,SETUBAL,100.0,800
ARRENDAMENTO |Apartamento T3|Totalmente remodelado|Estrela,Apartamento,ESTRELA,LISBOA,LISBOA,102.0,2150
Apartamento T2 para arrendamento,Apartamento,AMORA,SEIXAL,SETUBAL,80.99,800
Aluga-se T2 como novo Maia Gueifaes,Apartamento,CIDADE DA MAIA,MAIA,PORTO,105.0,875
Apartamento T0 Palmela Village,Apartamento,QUINTA DO ANJO,PALMELA,SETUBAL,46.67,750
Apartamento T1 para arrendamento,Apartamento,SANTA IRIA DE AZOIA,LOURES,LISBOA,59.3,850
Apartamento T0 – Centro de Aveiro,Apartamento,GLORIA,AVEIRO,AVEIRO,35.0,725
Arrendamento  Póvoa de Varzim,Apartamento,POVOA DE VARZIM,POVOA DE VARZIM,PORTO,84.0,1290
Apartamento para Arrendar T2 com Terraço e Marquise,Apartamento,QUELUZ,SINTRA,LISBOA,75.0,820
Apartamento para Arrendar T2  com Terraço e Marquise,Apartamento,QUELUZ,SINTRA,LISBOA,75.0,820
Aluga | Apartamento T4 Avenida da República | prédio da Sombra | Lisbo,Apartamento,AVENIDAS NOVAS,LISBOA,LISBOA,200.0,5500
"Moradia T3 com piscina, no condomínio Bom Sucesso Resort,...",Moradia,VAU,OBIDOS,LEIRIA,161.0,2450
Apartamento T1 Mobilado - Centro de Aveiro,Apartamento,ESGUEIRA,ESGUEIRA,AVEIRO,75.75,1200
Arrendamento T1 de luxo novo nos Clérigos,Apartamento,CEDOFEITA,PORTO,PORTO,60.3,1950
Apartamento T2 para arrendamento com móveis no Parque das Nações,Apartamento,PARQUE DAS NACOES,LISBOA,LISBOA,77.7,1750
APARTAMENTO T4+1 MOBILADO NO ESTORIL,Apartamento,CASCAIS,CASCAIS,LISBOA,132.0,6000
Apartamento T3 para arrendamento com vista mar no Bairro do Rosário,Apartamento,CASCAIS,CASCAIS,LISBOA,119.0,2800
Apartamento T3 com Vista Mar em Matosinhos Sul,Apartamento,MATOSINHOS,MATOSINHOS,PORTO,129.0,2550
Apartamento T4 na zona de Serralves,Apartamento,LORDELO DO OURO,PORTO,PORTO,167.0,3500
T 3 I ARRENDAMEMTO I NA AV. URUGUAI I MUITA LUZ I ANDAR ALTO COM VISTA,Apartamento,BENFICA,LISBOA,LISBOA,85.0,1500
Apartamento T3 com garagem e vista mar para arrendar no Monte Estoril,Apartamento,CASCAIS,CASCAIS,LISBOA,180.0,4400
T2 | Condomínio Fechado | Mobilado e Equipado | Terraço |...,Apartamento,SANTA MARINHA,VILA NOVA DE GAIA,PORTO,105.0,1900
Espetacular Apartamento T3  totalmente renovado  nos Jardins da Arrábi,Apartamento,SANTA MARINHA,VILA NOVA DE GAIA,PORTO,142.0,2150
"Apartamento T5, no Empreendimento Skycity, Carnaxide",Apartamento,VENTEIRA,AMADORA,LISBOA,178.0,5800
MORADIA T3 QUINTA BELOURA PISCINA AQUECIDA,Moradia,SINTRA,SINTRA,LISBOA,185.0,6000
Moradia T5 para arrendamento,Moradia,ALCABIDECHE,CASCAIS,LISBOA,231.66,6500
"partamento T3+1 com ou sem móveis, para arrendar no Estor...",Apartamento,CASCAIS,CASCAIS,LISBOA,255.0,6500
Triplex mobiliado de 3 quartos e jacuzzi,Apartamento,PARQUE DAS NACOES,LISBOA,LISBOA,267.2,6500
Apartamento T3 para arrendamento,Apartamento,MISERICORDIA,LISBOA,LISBOA,160.0,6500
Apartamento T3 duplex com vista deslumbrante sobre Lisboa...,Apartamento,SANTA MARIA MAIOR,LISBOA,LISBOA,135.0,6500
Apartamento T1 com terraço – próximo da CP,Apartamento,ESGUEIRA,ESGUEIRA,AVEIRO,60.0,650
T2 com duas casas de banho e mobilado.,Apartamento,ALCOCHETE,ALCOCHETE,SETUBAL,103.0,1400
Apartamento T2 Expo Norte,Apartamento,PARQUE DAS NACOES,LISBOA,LISBOA,100.0,1800
T0 para arrendamento,Apartamento,MACEDO DE CAVALEIROS,MACEDO DE CAVALEIROS,BRAGANCA,20.0,250
T3 Av Brasil com varanda e garagem na Av Brasil.,Apartamento,ALDOAR,PORTO,PORTO,140.0,5500
T3 mobilado para arrendar no Parque das Nações,Apartamento,PARQUE DAS NACOES,LISBOA,LISBOA,111.0,2500
Apartamento T3 a estrear junto à Quinta das Conchas,Apartamento,LUMIAR,LISBOA,LISBOA,90.0,1750
"Apartamento T2 sem móveis para arrendar, novo a estrear, ...",Apartamento,CASCAIS,CASCAIS,LISBOA,144.86,6000
Excelente Apartamento T2 com Jardim na Parede,Apartamento,CARCAVELOS,CASCAIS,LISBOA,85.0,2500
Moradia T4 com piscina na Charneca de Caparica e Sobreda,Moradia,CHARNECA DE CAPARICA,ALMADA,SETUBAL,369.0,6000
Apartamento T3 Novo com Varanda e Garagem em Paranhos,Apartamento,PARANHOS,PORTO,PORTO,116.95,1950
"Apartamento T2+1 para arrendamento, sem móveis em Arroios",Apartamento,AREEIRO,LISBOA,LISBOA,125.0,2400
"Apartamento T3 em Lisboa de 85,00 m2",Apartamento,BELEM,LISBOA,LISBOA,85.0,1600
Apartamento T1 para arrendamento,Apartamento,SANTA MARIA MAIOR,LISBOA,LISBOA,58.0,1800
"Apartamento T2 Matosinhos sul, no edifício Nautilus II.",Apartamento,MATOSINHOS,MATOSINHOS,PORTO,80.0,2000
Apartamento T3 para arrendamento,Apartamento,BENFICA,LISBOA,LISBOA,105.0,1590
Escritório/Apartamento T3,Apartamento,COIMBRA,SANTA CRUZ,COIMBRA,995.0,1500
"Moradia T1 Independente, 80 m2 – Charneca da Caparica",Moradia,CHARNECA DE CAPARICA,ALMADA,SETUBAL,70.0,850
"T3 Matosinhos, novo, perto da praia",Apartamento,MATOSINHOS,MATOSINHOS,PORTO,130.0,2400
Apartamento T1 para arrendamento,Apartamento,MADALENA,VILA NOVA DE GAIA,PORTO,65.0,850
Arrenda-se ótimo apartamento T2 na melhor zona da cidade,Apartamento,OLIVEIRA DE AZEMEIS,SANTIAGO DE RIBA-UL,AVEIRO,120.0,900
Apartamento T2 para arrendamento,Apartamento,LOURES,LOURES,LISBOA,57.0,1150
Arrenda-se T1 perto marquês pombal,Apartamento,LORDELO DO OURO,PORTO,PORTO,48.0,1000
"Apartamento T3 Aveiro, Esgueira, próximo de escolas",Apartamento,ESGUEIRA,ESGUEIRA,AVEIRO,130.0,1200
Arrenda-se apartamento T0 mobilado na rua Ferreira Borges,Apartamento,SANTO ANTONIO DOS OLIVAIS,COIMBRA,COIMBRA,35.0,490
Excelente T3 I Arrendamento I Remodelado a estrear I Junto ao Hospital,Apartamento,ARROIOS,LISBOA,LISBOA,125.0,2980
"T3 ao Hospital de São João, Porto",Apartamento,PEDROUCOS,MAIA,PORTO,132.0,1500
Apartamento T2 Arco do Cego,Apartamento,ARROIOS,LISBOA,LISBOA,69.0,1200
Apartamento T4 sem móveis em condomínio fechado em Cascais,Apartamento,CASCAIS,CASCAIS,LISBOA,180.0,6300
"Casa de campo charmosa T5+1 mobilada e equipada, com jard...",Moradia,AZEITAO,SETUBAL ,SETUBAL,250.0,6000
"Moradia, 5 quartos, Lisboa, Restelo Estádio",Moradia,BELEM,LISBOA,LISBOA,254.0,6000
Apartamento T3 em São Félix da Marinha na 1ª Linha do Mar Rés-do-Chão,Apartamento,SAO FELIX DA MARINHA,VILA NOVA DE GAIA,PORTO,160.0,1250
Apartamento T5 Mobilado c/ Garagem dupla fechada - Figueira da Foz,Apartamento,BUARCOS,FIGUEIRA DA FOZ,COIMBRA,135.0,1326
T3 | Penthouse | Paço do Rei | Mobilado | Equipado | Maia...,Apartamento,MAFAMUDE,VILA NOVA DE GAIA,PORTO,130.0,2200
Apartamento T3 para arrendamento sem móveis em São Vicente,Apartamento,SAO VICENTE,SAO VICENTE,LISBOA,105.0,2400
MORADIA T4 + 1 EM ALCABIDECHE,Moradia,ALCABIDECHE,CASCAIS,LISBOA,180.0,5500
Moradia T5 arrendamento em condomínio de luxo || Cascais,Moradia,CASCAIS,CASCAIS,LISBOA,633.0,6000
"Apartamento T3, situado em Condeixa-a-Nova, com 121m2 e g...",Apartamento,CONDEIXA-A-VELHA,CONDEIXA-A-NOVA,COIMBRA,121.0,800
Apartamento T3 para arrendamento em condomínio com piscina em Cascais,Apartamento,CASCAIS,CASCAIS,LISBOA,140.0,4300
Moradia geminada T3 sem móveis nova a estrear para arrend...,Moradia,SAO DOMINGOS DE RANA,CASCAIS,LISBOA,153.0,4000
"Moradia T4 com piscina, no Bom Sucesso Resort, Óbidos",Moradia,VAU,OBIDOS,LEIRIA,225.0,3000
Moradia T3 para arrendamento,Moradia,BRITELO,PONTE DA BARCA,VIANA DO CASTELO,153.0,1650
Apartamento T1 no Bairro do Rosário a 5 minutos do Centro...,Apartamento,CASCAIS,CASCAIS,LISBOA,51.0,1440
Apartamento T3 - Quinta das Patinhas,Apartamento,CASCAIS,CASCAIS,LISBOA,123.61,2900
"Moradia T4 sem móveis para arrendar no Cobre, inserida em...",Moradia,CASCAIS,CASCAIS,LISBOA,176.0,3900
Apartamento T2 para arrendamento Av. Infante Santo com ga...,Apartamento,ESTRELA,LISBOA,LISBOA,108.0,3000
T2 na Madalena,Apartamento,GULPILHARES,VILA NOVA DE GAIA,PORTO,108.0,2200
Apartamento T3 para arrendar no Restelo com 110m2 | Lisboa,Apartamento,BELEM,LISBOA,LISBOA,110.0,2300
