anuncio/propriedade,tipo,FREGUESIA,CONCELHO,DISTRITO,area(m²),valor renda(€/mes)
Apartment in Benfica,Apartamento,BENFICA,LISBOA,LISBOA,97.0,2150
Apartamento T2 mobilado no Parque dos Príncipes com lugar de parqueame,Apartamento,LUMIAR,LISBOA,LISBOA,100.0,2000
Arrendamento de T2 – Zona do Tribunal e Parque Municipal – Montijo,Apartamento,MONTIJO,MONTIJO,SETUBAL,73.0,850
Apartamento T2 Novo c/ Vistas Rio na Afurada,Apartamento,SANTA MARINHA,VILA NOVA DE GAIA,PORTO,122.0,1980
"Excelente T1, a 220 m do Metro Marquês, Porto, Cedofeita",Apartamento,CEDOFEITA,PORTO,PORTO,54.0,1100
T2 Mobilado + Garag. Pingo Doce. R. República. Disponível a 25 Março,Apartamento,BUARCOS,FIGUEIRA DA FOZ,COIMBRA,95.0,800
T2 junto ao Liceu - Escolas e Parque Verde,Apartamento,BUARCOS,FIGUEIRA DA FOZ,COIMBRA,100.0,800
Apartamento T1 totalmente remodelado nas Avenidas Novas,Apartamento,AVENIDAS NOVAS,LISBOA,LISBOA,45.0,1300
"Apartamento T2 em São Marcos, Cacém",Apartamento,CACEM,SINTRA,LISBOA,90.0,1000
Apartamento T2 para arrendamento,Apartamento,ARROIOS,LISBOA,LISBOA,67.7,1450
"Apartamento T1 no Pai do Vento, Cascais",Apartamento,ALCABIDECHE,CASCAIS,LISBOA,67.0,1000
T3 Guimarães - como novo,Apartamento,URGEZES,GUIMARAES,BRAGA,140.0,1070
Andar moradia t3 mobilado na Rua do Lidador em Aldoar com jardim e box,Apartamento,ALDOAR,PORTO,PORTO,120.0,1800
Apartamento T2 para arrendamento,Apartamento,LUMIAR,LISBOA,LISBOA,100.0,2300
Apartamento T3 para arrendamento,Apartamento,MOSCAVIDE,LOURES,LISBOA,133.0,1600
Apartamento T1 para arrendamento,Apartamento,PARANHOS,PORTO,PORTO,66.0,1050
T1 com varanda junto ao estadio de Luz,Apartamento,SAO DOMINGOS DE BENFICA,LISBOA,LISBOA,61.2,1500
Apartamento T3 para arrendamento,Apartamento,ALVERCA DO RIBATEJO,VILA FRANCA DE XIRA,LISBOA,119.4,1650
Arrendamento T0 com 40m2 na Rua Santa Catarina,Apartamento,CEDOFEITA,PORTO,PORTO,40.0,900
Moradia T4 para arrendamento,Moradia,SOURE,SOURE,COIMBRA,146.0,600
Apartamento T2 para arrendamento,Apartamento,OEIRAS,OEIRAS,LISBOA,88.0,1550
T3 Real BRAGA (Parretas),Apartamento,REAL,BRAGA,BRAGA,116.0,1000
Apartamento T2 - a 100 m do mar COSTA NOVA!,Apartamento,GAFANHA DA ENCARNACAO,ILHAVO,AVEIRO,80.0,1000
Quinta do Anjo/ Portais da Arrábida - Apartamento de 3 assoalhadas com,Apartamento,AZEITAO,SETUBAL ,SETUBAL,98.0,800
"Apartamento T1, junto ao Hospital de S. João",Apartamento,PEDROUCOS,MAIA,PORTO,65.0,1100
"Apartamento T3 totalmente remodelado, para arrendamento no Lumiar.",Apartamento,LUMIAR,LISBOA,LISBOA,105.0,1650
Arrendamento T3 em Santa Marta do Pinhal,Apartamento,CORROIOS,SEIXAL,SETUBAL,104.0,1250
Apartamento T1 para arrendamento,Apartamento,SAO VICENTE,SAO VICENTE,LISBOA,62.73,1600
Apartamento T2 com garagem em zona da Lousã,Apartamento,LOUSA,LOUSA,COIMBRA,80.0,650
Apartamento T1 para arrendamento,Apartamento,CEDOFEITA,PORTO,PORTO,74.0,800
Apartamento T2+1 | Arrendamento | Renovado | Av. França | Garagem | Me,Apartamento,CEDOFEITA,PORTO,PORTO,107.0,1800
"Casa T1 mobilado, Junto ao Rio Douro, Marina de Caldas de Aregos",Apartamento,ANREADE,RESENDE,VISEU,34.0,600
T1+1 Totalmente Renovado com terraço,Apartamento,BEATO,LISBOA,LISBOA,54.0,1350
Apartamento T3 Duplex na Cooperativa Arquitetos em Aldoar,Apartamento,ALDOAR,PORTO,PORTO,149.0,1575
Apartamento T1 para arrendamento,Apartamento,AREEIRO,LISBOA,LISBOA,65.85,1700
T1 renovado no Alto da Pampilheira para arrendamento,Apartamento,CASCAIS,CASCAIS,LISBOA,45.0,1500
T2 Prq dos Principes - Arrendamento,Apartamento,LUMIAR,LISBOA,LISBOA,108.0,1700
Apartamento T2 | Telheiras Centro,Apartamento,LUMIAR,LISBOA,LISBOA,77.0,1500
"Apartamento T3, quarto andar, Av. Dr. Lourenço Peixinho, Aveiro",Apartamento,GLORIA,AVEIRO,AVEIRO,87.17,1350
Arrendamento de curta e ou média duração,Apartamento,COSTA DA CAPARICA,ALMADA,SETUBAL,55.0,850
Arrendo moradia independente,Moradia,OLIVEIRA DO DOURO,VILA NOVA DE GAIA,PORTO,130.0,850
Apartamento em Buarcos,Apartamento,BUARCOS,FIGUEIRA DA FOZ,COIMBRA,65.0,640
T2+1 na Povoa de Varzim para professores -Junto às Escolas,Apartamento,POVOA DE VARZIM,POVOA DE VARZIM,PORTO,100.0,600
Centro Maia,Apartamento,CIDADE DA MAIA,MAIA,PORTO,65.0,750
Alugo t2 na zona do Porto,Apartamento,PEDROUCOS,MAIA,PORTO,40.0,800
Arrendo Casa em Fafe,Moradia,QUINCHAES,FAFE,BRAGA,300.0,550
"Apartamento tipo T3, para arrendar.",Apartamento,BRAGA,BRAGA,BRAGA,150.0,800
Casinha t2 para alugar,Moradia,LAMEGO,LAMEGO,VISEU,70.0,350
"T0 mobiliado e equipado em Paço d'arcos, Oeiras",Apartamento,OEIRAS,OEIRAS,LISBOA,50.0,800
T3 em Telheiras,Apartamento,LUMIAR,LISBOA,LISBOA,120.0,2100
T2 mobiliado no centro de Macedo,Apartamento,MACEDO DE CAVALEIROS,MACEDO DE CAVALEIROS,BRAGANCA,70.0,330
T1 Férias Edifício Panoramic parque das nações/ curta duração,Apartamento,PARQUE DAS NACOES,LISBOA,LISBOA,70.0,1500
"Apartamento equipado, muito perto dos transportes, em Cacilhas.",Apartamento,ALMADA,ALMADA,SETUBAL,60.0,1100
Apartamento T3 Carnaxide,Apartamento,CARNAXIDE,OEIRAS,LISBOA,120.0,1250
Apartamento T2 para arrendamento,Apartamento,CARCAVELOS,CASCAIS,LISBOA,69.5,800
"Apartamento T2 novo com terraço privado no Cond. Rouxinóis, Esposende",Apartamento,ESPOSENDE,MARINHAS,BRAGA,70.0,1100
Arrendamento / Apartamento T3 / Terraço / Bombarral,Apartamento,BOMBARRAL,BOMBARRAL,LEIRIA,170.0,1100
T3 pronto habitar no Aviz - Porto,Apartamento,ALDOAR,PORTO,PORTO,114.0,1700
T4 | Av. Defensores de Chaves,Apartamento,AVENIDAS NOVAS,LISBOA,LISBOA,100.0,1500
T1  Flat  Apartamento  Campo Valongo Gandra junto Cespu,Apartamento,GANDRA,PAREDES,PORTO,65.0,650
"Arremda-se T0, canal de S. Roque junto ao Rossio em Aveiro",Apartamento,GLORIA,AVEIRO,AVEIRO,45.0,750
Apartamento T2 para arrendamento no centro de Caneças,Apartamento,RAMADA,ODIVELAS,LISBOA,62.0,850
T1 KIT Paranhos - Polo Univ. Igreja / Metro,Apartamento,PARANHOS,PORTO,PORTO,55.0,625
Apartamento T1 em Lordelo do Ouro,Apartamento,LORDELO DO OURO,PORTO,PORTO,50.0,950
Apartamentos T0 - totalmente equipados - Centro Braga,Apartamento,BRAGA,BRAGA,BRAGA,30.0,750
Arrenda-se T3 em Caramos-Felgueiras,Apartamento,AIRAES,FELGUEIRAS,PORTO,100.0,550
Apartamento T2 para arrendamento,Apartamento,POMBAL,POMBAL,LEIRIA,86.0,600
Apartamento T1 em Caselas,Apartamento,BELEM,LISBOA,LISBOA,30.0,1000
"Quintinha de Charme para arrendar com Moradia T4,  jardim e piscina  .",Moradia,CASCAIS,CASCAIS,LISBOA,332.0,9500
"Arrendamento TOP! Apartamento 4 quartos, 171m2 área, varanda, cozinha",Apartamento,SAO DOMINGOS DE BENFICA,LISBOA,LISBOA,171.0,3900
Arrenda-se Excelente T3 Mobillado ao Palacio de Cristal,Apartamento,LORDELO DO OURO,PORTO,PORTO,116.0,1600
Moradia T3 para arrendamento,Moradia,CHARNECA DE CAPARICA,ALMADA,SETUBAL,179.0,1650
Estúdio Totalmente Renovado na Urbanização Padrão da Légua,Apartamento,CUSTOIAS,LECA DO BALIO,PORTO,40.0,500
"Apartamento T1 em Lisboa de 76,00 m2",Apartamento,TURCIFAL,TORRES VEDRAS,LISBOA,76.0,1200
T2 com terraço na Pontinha,Apartamento,PONTINHA,ODIVELAS,LISBOA,90.0,1200
T2+1 Centro Vagos,Apartamento,VAGOS,VAGOS,AVEIRO,83.0,650
Apartamento todo Renovado,Apartamento,PONTINHA,ODIVELAS,LISBOA,60.0,800
"T2 Remodulado como novo, c/ lugar garagem, 1050€",Apartamento,CANELAS,VILA NOVA DE GAIA,PORTO,60.0,1050
Apartamento T1 renovado no centro de Lisboa ao lado Hospital c/terraço,Apartamento,AVENIDAS NOVAS,LISBOA,LISBOA,50.0,1200
Arrenda-se T1+1 em Moradia Térrea,Apartamento,CEDOFEITA,PORTO,PORTO,65.0,700
Alugo casa odivelas,Moradia,ODIVELAS,ODIVELAS,LISBOA,30.0,850
Arrenda-se Apartamento,Apartamento,SOBRADO,CASTELO DE PAIVA,AVEIRO,90.0,500
T0 com ginasio e area de lazer,Apartamento,PARANHOS,PORTO,PORTO,32.0,658
Apartamento T2 totalmente renovado - Ceira,Apartamento,SANTO ANTONIO DOS OLIVAIS,COIMBRA,COIMBRA,65.0,700
Quinta com 2 moradias mobiladas em Tábua,Moradia,CANDOSA,TABUA,COIMBRA,15000.0,1500
Moradia T4 Bicuda,Moradia,CASCAIS,CASCAIS,LISBOA,259.0,4000
Apartamento T2 Arrendar,Apartamento,TOMAR,TOMAR,SANTAREM,88.0,800
Apartamento T2+1,Apartamento,BUARCOS,FIGUEIRA DA FOZ,COIMBRA,81.0,800
Apartamento T2 luxo em Lordelo do Ouro,Apartamento,LORDELO DO OURO,PORTO,PORTO,120.0,2900
Apartamento T3 para arrendamento,Apartamento,ARROIOS,LISBOA,LISBOA,73.05,2300
Apartamento T5 | Arrendamento | Renovado | Boavista | Garagem | Arrumo,Apartamento,LORDELO DE OURO,LORDELO DE OURO,PORTO,230.0,3000
"Apartamento T3, novo, com terraço e garagem no Porto",Apartamento,PARANHOS,PORTO,PORTO,109.05,1800
APARTAMENTO T4 +1 - Palácio da Junqueira - disponível par...,Apartamento,ALCANTARA,LISBOA,LISBOA,300.0,6000
"Apartamento de T2, localizado em Agualva Cacém, a 650 metros da estaçã",Apartamento,AGUALVA,SINTRA,LISBOA,70.0,1000
Apartamento T1Kit novo na Boavista,Apartamento,RAMALDE,PORTO,PORTO,56.0,1500
Apartamento T3 junto à praia | Paço de Arcos,Apartamento,OEIRAS,OEIRAS,LISBOA,99.0,1800
"Apartamento T2, Barreiro",Apartamento,BARREIRO,BARREIRO,SETUBAL,62.0,1000
Apartamento T3 para arrendamento,Apartamento,SANTA MARINHA,VILA NOVA DE GAIA,PORTO,130.0,1800
Apartamento T2 para arrendamento,Apartamento,AVENIDAS NOVAS,LISBOA,LISBOA,107.9,3600
Apartamento T2 renovado Ceira,Apartamento,SANTO ANTONIO DOS OLIVAIS,COIMBRA,COIMBRA,65.0,700
Apartamento T0 em Caxias para ARRENDAR,Apartamento,OEIRAS,OEIRAS,LISBOA,22.0,750
Apartamento T2 para arrendamento,Apartamento,SAO DOMINGOS DE RANA,CASCAIS,LISBOA,83.5,1350
Arrendo Apartamento p/ Professores - Escola Damião de Goes- Alenquer,Apartamento,ALENQUER,ALENQUER,LISBOA,90.0,300
"Apartamento T2 em Lisboa de 130,00 m2",Apartamento,RIO DE MOURO,SINTRA,LISBOA,130.0,1300
T3 nos Olivais,Apartamento,OLIVAIS,LISBOA,LISBOA,60.0,1150
T1 em Buracos  arrendamento anual,Apartamento,BUARCOS,FIGUEIRA DA FOZ,COIMBRA,50.0,500
Apartmenento T2 sol e mar,Apartamento,CHARNECA DE CAPARICA,ALMADA,SETUBAL,100.0,1150
"T0 + 1 - Ap. Novo, com 1 garagem, excelente localização!",Apartamento,MAFAMUDE,VILA NOVA DE GAIA,PORTO,42.6,900
"T2 Com Garagem, Arrumos e Varanda em Paranhos no Porto",Apartamento,PARANHOS,PORTO,PORTO,90.0,1350
T2 no Alto de Santo Amaro,Apartamento,ALCANTARA,LISBOA,LISBOA,66.0,1500
T1 Lazarim,Apartamento,CAPARICA,ALMADA,SETUBAL,61.5,980
Arrendamento de Estúdio T0,Apartamento,CAMPANHA,CAMPANHA,PORTO,65.0,850
"Excelente apartamento T3, MOBILADO, a 1,1 km do centro de Braga.",Apartamento,REAL,BRAGA,BRAGA,129.0,1100
"Apartamento T3 c/150m2, Varanda e 2 Lug. Garagem em Francos, Ramalde",Apartamento,RAMALDE,PORTO,PORTO,151.0,1850
Quinta T3 para arrendamento,Moradia,SAO MIGUEL DO SOUTO,SANTA MARIA DA FEIRA,AVEIRO,12000.0,9000
Quinta T1 para arrendamento,Moradia,SAO MIGUEL DO SOUTO,SANTA MARIA DA FEIRA,AVEIRO,12000.0,6000
Apartamento T2 para arrendamento,Apartamento,PARQUE DAS NACOES,LISBOA,LISBOA,105.0,3900
Moradia T4 para arrendamento,Moradia,SANTA BARBARA DE NEXE,FARO,FARO,244.8,8000
"Apartamento T1, Arrendamento, Bairro da Assunção.",Apartamento,CASCAIS,CASCAIS,LISBOA,62.0,1200
Apartamento T4 Remodelado Campo de Ourique com jardim,Apartamento,CAMPO DE OURIQUE,LISBOA,LISBOA,96.3,3250
"Apartamento T4 em Porto Salvo, Oeiras, mobilado e equipado",Apartamento,PORTO SALVO,OEIRAS,LISBOA,131.0,2200
Fantástico apartamento T4,Apartamento,CARCAVELOS,CASCAIS,LISBOA,145.0,2950
Apartamento T3 para Arrendamento,Apartamento,SAO SEBASTIAO,SAO SEBASTIAO,SETUBAL,111.0,2000
Arrenda-se apartamento T2 mobilado e equipado.,Apartamento,EIRAS,EIRAS,COIMBRA,70.0,700
Moradia Isolada T5 - Quinta do Rosário em Cascais,Moradia,CASCAIS,CASCAIS,LISBOA,380.0,8500
Moradia T4 - Braga Fraião,Moradia,NOGUEIRA,BRAGA,BRAGA,182.0,2000
Apartamento T3 para arrendar em Odivelas,Apartamento,ODIVELAS,ODIVELAS,LISBOA,81.0,1500
"A 800 m da praia, vista mar, varandas, terraço, ultimo piso",Apartamento,CASCAIS,CASCAIS,LISBOA,165.0,2600
T3 Novo - Empreendimento Magnólia City,Apartamento,OLIVEIRA DO DOURO,VILA NOVA DE GAIA,PORTO,148.0,1800
"Apartamento T3, com Sótão, S. Victor- Braga",Apartamento,BRAGA,BRAGA,BRAGA,109.0,1100
Apartamento T3 mobilado e equipado no Freixo,Apartamento,CAMPANHA,CAMPANHA,PORTO,167.5,2100
Arrendamento Apartamento T1 Renovado - Bonfim,Apartamento,CAMPANHA,CAMPANHA,PORTO,45.0,950
"Apartamento T3 todo remodelado, em Paranhos",Apartamento,PARANHOS,PORTO,PORTO,120.0,1600
Moradia T3 nova com piscina e garagem em box na 'Quinta Faro',Moradia,MONTENEGRO,MONTENEGRO,FARO,182.0,6000
Apartamento T1Kit em Campanhã,Apartamento,CAMPANHA,CAMPANHA,PORTO,40.0,1450
Moradia T4 para arrendamento em Alcabideche!,Moradia,ALCABIDECHE,CASCAIS,LISBOA,121.0,2500
"T1 Bairro Alto (Super Central, a 3 minutos a pé da Praça Camões)",Apartamento,MISERICORDIA,LISBOA,LISBOA,50.0,1300
Apartamento T3 de luxo em Matosinhos,Apartamento,MATOSINHOS,MATOSINHOS,PORTO,128.1,2400
Apartamento na Amorosa,Apartamento,CHAFE,CHAFE,VIANA DO CASTELO,90.0,400
Quinta T4 para arrendamento,Moradia,AZEITAO,SETUBAL ,SETUBAL,10190.0,3900
Apartamento T2 para arrendamento,Apartamento,SAO MARTINHO DO PORTO,ALCOBACA,LEIRIA,60.0,650
Apartamento T2 para arrendamento,Apartamento,VIALONGA,VILA FRANCA DE XIRA,LISBOA,60.3,900
Excelente Apartamento T2+2 de Charme remodelado em São Vi...,Apartamento,SAO VICENTE,SAO VICENTE,LISBOA,151.0,1990
T1 Duplex Porto,Apartamento,PARANHOS,PORTO,PORTO,72.0,1300
T0 para arrendar junto estação de comboios da Reboleira,Apartamento,AGUAS LIVRES,AMADORA,LISBOA,34.0,600
Apartamento T1+1 Baixa da Banheira -1ºpiso zona central,Apartamento,BAIXA DA BANHEIRA,MOITA,SETUBAL,51.0,750
T1 à Casa sa Música,Apartamento,CEDOFEITA,PORTO,PORTO,58.0,850
Excelente Apartamento T3 na Boavista,Apartamento,CEDOFEITA,PORTO,PORTO,120.0,1400
"T3 em São Roque, Oliveira de Azeméis",Apartamento,OLIVEIRA DE AZEMEIS,SANTIAGO DE RIBA-UL,AVEIRO,60.0,600
Apartamento T3 para arrendamento,Apartamento,SETUBAL,NOSSA SENHORA DA ANUNCIADA,SETUBAL,104.5,1100
Apartamento T2 para arrendamento,Apartamento,CACEM,SINTRA,LISBOA,65.0,920
São Domingos de Benfica | Apartamento T2 para arrendamento,Apartamento,SAO DOMINGOS DE BENFICA,LISBOA,LISBOA,72.0,1300
Apartamento T2 para arrendamento,Apartamento,CAMPOLIDE,LISBOA,LISBOA,85.0,1800
"Excelente T2, totalmente mobilado, junto a Av Liberdade",Apartamento,SANTO ANTONIO,LISBOA,LISBOA,33.0,1500
"Apartamento T1 remodelado, em Campolide, Lisboa",Apartamento,CAMPOLIDE,LISBOA,LISBOA,50.0,1250
Apartamento T2 com garagem centro histórico de Cascais,Apartamento,CASCAIS,CASCAIS,LISBOA,82.4,2000
APARTAMENTO T3 MOBILIADO NA AVENIDA DA REPÚBLICA COM PISC...,Apartamento,MAFAMUDE,VILA NOVA DE GAIA,PORTO,141.0,1750
"APARTAMENTO T0 NO LARGO DOS LÓIOS - ALIADOS, PORTO",Apartamento,CEDOFEITA,PORTO,PORTO,74.0,1300
"T1 na Rua do Bonjardim, 637",Apartamento,CEDOFEITA,PORTO,PORTO,55.0,1250
Apartamento T8 Rua Silva Carvalho Campo de Ourique,Apartamento,CAMPO DE OURIQUE,LISBOA,LISBOA,132.0,3000
"Moradia T4 isolada, com jardim e piscina, em Mindelo",Moradia,MINDELO,VILA DO CONDE,PORTO,284.0,3500
"Apartamento T3 Renovado p/ arrendamento na Avenida da Liberdade, Braga",Apartamento,BRAGA,BRAGA ,BRAGA,102.0,1200
T1 na Praça da República Mobilado e Equipado,Apartamento,CEDOFEITA,PORTO,PORTO,60.0,1100
Moradia T2 Duplex de luxo à Estação do Metro Carolina Michaelis,Moradia,CEDOFEITA,PORTO,PORTO,160.0,2800
"Apartamento T1 Remodelado e Mobilado em Campo de Ourique, Lisboa",Apartamento,CAMPO DE OURIQUE,LISBOA,LISBOA,45.0,1350
Apartamento duplex t1 totalmente remodelado no centro do Porto,Apartamento,CEDOFEITA,PORTO,PORTO,57.0,1150
Apartamento T3 para arrendamento,Apartamento,TORRES NOVAS,SALVADOR,SANTAREM,145.0,1100
CONSTRUÇÃO DE 2018 - T0 - MOBILADO - PARA ARRENDAMENTO - JUNTO À PRAIA,Apartamento,CANIDELO,VILA NOVA DE GAIA,PORTO,41.0,1200
T1+1 em Cascais - Condomínio c/ piscina,Apartamento,CASCAIS,CASCAIS,LISBOA,110.0,1750
Apartamento T3 Lumiar,Apartamento,SANTA CLARA,LISBOA,LISBOA,127.0,1700
APARTAMENTO T1 EQUIPADO E MOBILADO EM ALFAMA,Apartamento,SAO VICENTE,SAO VICENTE,LISBOA,54.0,1350
T0 Estudio Vista Mar - Golden Clube - Cabanas de Tavira,Apartamento,CONCEICAO,TAVIRA,FARO,35.0,650
Apartamento T0 remodelado centro da cidade APA2990/24,Apartamento,TOMAR,TOMAR,SANTAREM,65.0,500
Casa p aluguer Sátão,Moradia,SATAO,SATAO,VISEU,70.0,350
ALUGA-SE T3+1 Boavista Mobilado,Apartamento,CEDOFEITA,PORTO,PORTO,115.0,2350
Apartamento na Praia de Sta Cruz,Apartamento,SILVEIRA,TORRES VEDRAS,LISBOA,65.0,700
Apartamento T2 para arrendamento,Apartamento,OEIRAS,OEIRAS,LISBOA,71.0,1400
Apartamento T2 para arrendamento,Apartamento,ESTRELA,LISBOA,LISBOA,123.0,1700
Arrendo T1 juntos as escolas ermesinde,Apartamento,ERMESINDE,VALONGO,PORTO,80.0,750
Apartamento T1 Quintã - Guimarães,Apartamento,AZUREM,GUIMARAES,BRAGA,48.0,600
T2 em Canidelo,Apartamento,CANIDELO,VILA NOVA DE GAIA,PORTO,97.0,1750
Apartamento T1 mobilado | Novo | Bairro dos Atores,Apartamento,AREEIRO,LISBOA,LISBOA,60.0,1350
T2 Torre Marinha Central Equipado,Apartamento,SEIXAL,ARRENTELA,SETUBAL,70.0,1200
Apartamento T2 para arrendar no Junqueiro,Apartamento,CARCAVELOS,CASCAIS,LISBOA,68.0,1600
"Moradia T9 sem móveis, localizada na Quinta do Patino - E...",Moradia,ALCABIDECHE,CASCAIS,LISBOA,551.0,38000
"Apartamento T1 mobilado e equipado, à Estação de Campanhã, Bonfim",Apartamento,CAMPANHA,CAMPANHA,PORTO,60.0,800
Apartamento T2+1 mobilado para arrendamento Canidelo,Apartamento,CANIDELO,VILA NOVA DE GAIA,PORTO,150.0,2300
Apartamento T3 para arrendamento,Apartamento,BARCARENA,OEIRAS,LISBOA,121.0,2350
Apartamento T3 para arrendamento,Apartamento,RAMALDE,PORTO,PORTO,134.0,2250
Moradia T5 para arrendamento,Moradia,ALCABIDECHE,CASCAIS,LISBOA,324.0,8500
Apartamento T2 para arrendamento,Apartamento,SANTA MARINHA,VILA NOVA DE GAIA,PORTO,93.0,1200
Apartamento T2 mobilado com 2 lugares de parqueamento,Apartamento,ESTRELA,LISBOA,LISBOA,103.0,2250
Apartamento T3 em Braga,Apartamento,NOGUEIRO,NOGUEIRO,BRAGA,106.29,1900
Apartamento T0 | Telheiras Sul,Apartamento,LUMIAR,LISBOA,LISBOA,34.0,925
"T2 remodelado com cozinha equipada, em Carnide, Lisboa",Apartamento,CARNIDE,LISBOA,LISBOA,83.0,1500
Apartamento T1 para Arrendamento | Com arrecadação e parqueamento |  N,Apartamento,CARNAXIDE,OEIRAS,LISBOA,71.0,1100
Apartamento T2  para Arrendar em Monte Estoril,Apartamento,CASCAIS,CASCAIS,LISBOA,99.0,1950
Apartamento T2 para arrendamento,Apartamento,SEIXAL,ARRENTELA,SETUBAL,103.0,1150
Moradia para arrendar no centro de Cascais,Moradia,CASCAIS,CASCAIS,LISBOA,250.0,8000
"Apartamento T3 totalmente mobilado para arrendamento em Telheiras, em",Apartamento,LUMIAR,LISBOA,LISBOA,149.0,3500
"Apartamento T1 em condomínio privado de luxo, para arrendamento em Leç",Apartamento,MATOSINHOS,MATOSINHOS,PORTO,52.0,1200
"Apartamento T4 arrendar São Vicente, Braga",Apartamento,BRAGA,BRAGA,BRAGA,180.0,1600
Apartamento T2+1 em Condomínio Fechado,Apartamento,CANELAS,VILA NOVA DE GAIA,PORTO,85.0,1100
Apartamento T2 remodelado em Oeiras,Apartamento,OEIRAS,OEIRAS,LISBOA,80.0,1550
Imovel T2 Centro da Cidade Semi Mobilado e Parqueamento,Apartamento,SETUBAL,NOSSA SENHORA DA ANUNCIADA,SETUBAL,82.0,1300
Apartamento T2 para arrendamento,Apartamento,LUMIAR,LISBOA,LISBOA,89.1,1650
Apartamento T2 para arrendamento,Apartamento,LUMIAR,LISBOA,LISBOA,87.08,1600
"Apartamento totalmente remodelado. Em zona privilegiada, Ajuda.",Apartamento,AJUDA,AJUDA,LISBOA,55.0,1500
"Abrunheira. Fantástico apartamento de 2 assoalhadas,condomínio fechado",Apartamento,SINTRA,SINTRA,LISBOA,85.0,810
Apartamento T2 para arrendamento,Apartamento,CAMPANHA,CAMPANHA,PORTO,78.48,1900
Apartamento T3 entre Ourém e Fátima,Apartamento,ATOUGUIA,OUREM,SANTAREM,100.0,500
T2 mobilado e equipado,Moradia,SANTO ANTONIO DOS OLIVAIS,COIMBRA,COIMBRA,45.0,625
Á Avenida da Liberdade,Apartamento,SANTO ANTONIO,LISBOA,LISBOA,80.0,1500
T2 Agualva Cacém,Apartamento,CACEM,SINTRA,LISBOA,73.0,990
Arrendamento  T3 - Centro de  Guimarães,Apartamento,URGEZES,GUIMARAES,BRAGA,172.0,1500
T3 para arrendamento junto as piscinas do Sporting_Barrocas,Apartamento,GLORIA,AVEIRO,AVEIRO,115.0,1000
Apartamento T4 para arrendamento,Apartamento,SACAVEM,LOURES,LISBOA,258.0,3900
T1 - Ocean Terrace,Apartamento,MATOSINHOS,MATOSINHOS,PORTO,56.0,1550
Penthouse com 70 m2 no Parque Europa com opção de ser mobilado,Apartamento,LUMIAR,LISBOA,LISBOA,89.0,1200
"Arrendamento Foz T3 de 119m2, Apartamento T3, Renovado em Porto, Aldoa",Apartamento,ALDOAR,PORTO,PORTO,119.0,2200
"Fabuloso apartamento T3 para arrendamento em Belém (Restelo), com gara",Apartamento,BELEM,LISBOA,LISBOA,114.0,3250
"Apartamento T4+1 na Cruz Quebrada-Dafundo, com vista frontal rio!",Apartamento,ALGES,OEIRAS,LISBOA,220.0,5500
FANTASTICO T3 I  JARDINS DO CAMPO GRANDE 82 I CONDOMINIO  FECHADO I GA,Apartamento,ALVALADE,LISBOA,LISBOA,216.0,4000
Apartamento T4 Vista RIO | Restelo,Apartamento,BELEM,LISBOA,LISBOA,150.0,2900
"T3+1 Frente à praia do Molhe (Foz) - Renovado, mobilado,",Apartamento,ALDOAR,PORTO,PORTO,150.0,2900
T1 em prédio de luxo na Rua Correia Teles com Garagem (Campo de Ouriqu,Apartamento,CAMPO DE OURIQUE,LISBOA,LISBOA,70.0,2500
"Moradia na Rua Guerra Junqueiro, Lordelo do Ouro, Porto",Moradia,LORDELO DO OURO,PORTO,PORTO,240.0,4000
Apartamento T3 Duplex Trofa,Apartamento,BOUGADO,TROFA,PORTO,230.0,1250
Apartamento T4 Duplex em Paranhos,Apartamento,PARANHOS,PORTO,PORTO,123.6,2600
Apartamento T2 junto à Douro Marina para arrendamento,Apartamento,SANTA MARINHA,VILA NOVA DE GAIA,PORTO,63.0,1200
Estúdio inserido em moradia isolada ao lado da universidade de Aveiro,Moradia,ARADAS,ARADAS,AVEIRO,30.0,600
Riad T5 Arrendamento Faro,Moradia,SANTA BARBARA DE NEXE,FARO,FARO,240.0,3000
Apartamento T2 para arrendamento,Apartamento,BUARCOS,FIGUEIRA DA FOZ,COIMBRA,71.0,650
Apartamento T3 + 1 Totalmente Reabilitado,Apartamento,FATIMA,OUREM,SANTAREM,123.3,780
T1 Equipado com Varanda Generosa com Vista desafogada na Charneca C...,Apartamento,CHARNECA DE CAPARICA,ALMADA,SETUBAL,47.0,900
Apartamento T1+1 - S. Mamede de Infesta,Apartamento,SAO MAMEDE DE INFESTA,MATOSINHOS,PORTO,66.0,850
Moradia T1 para arrendamento,Moradia,CARCAVELOS,CASCAIS,LISBOA,32.0,1300
Apartamento T2+1 mobilado para arrendar em Cascais,Apartamento,CASCAIS,CASCAIS,LISBOA,148.51,3950
Apartamento T3 Com Garagem Dupla na Foz do Douro,Apartamento,ALDOAR,PORTO,PORTO,145.0,1800
T1 Arrendamento Remodelado Lisboa Central,Apartamento,PENHA DE FRANCA,LISBOA,LISBOA,60.0,1000
"Moradia T5 +2, com piscina, na Quinta do Lago, Algarve",Moradia,ALMANCIL,LOULE,FARO,770.17,30000
Apartamento  T2 -  Jardim e Piscina -  Novo empreendimento na Praça do,Apartamento,AREEIRO,LISBOA,LISBOA,77.0,1900
Apartamento T3 todo renovado c/garagem na Av. de Londres em Guimarães,Apartamento,OLIVEIRA,GUIMARAES,BRAGA,130.0,1460
Apartamento T1 - Boavista c/piscina e lugar garagem,Apartamento,CEDOFEITA,PORTO,PORTO,74.0,1400
"Apartamento T2 com terraço e garagem no Lumiar, Lisboa",Apartamento,LUMIAR,LISBOA,LISBOA,117.0,1950
Apartamento T4 Duplex no Centro Histórico de Braga,Apartamento,BRAGA,BRAGA,BRAGA,254.0,6000
"Arrendamento T3, Olaias",Apartamento,AREEIRO,LISBOA,LISBOA,92.0,2100
"Apartamento T3 Arrendamento em Parque das Nações,Lisboa",Apartamento,PARQUE DAS NACOES,LISBOA,LISBOA,105.0,2500
Apartamento T3 R/C elevado - Rua Passos Manuel / Arroios,Apartamento,ARROIOS,LISBOA,LISBOA,95.0,1990
T1 Terraço Equipado Mobilado Estação Metro Trindade Despesas Incluídas,Apartamento,CEDOFEITA,PORTO,PORTO,50.0,1200
Apartamento T3 pronto a habitar c/varanda - Urbanização d...,Apartamento,CARCAVELOS,CASCAIS,LISBOA,126.0,1700
Apartamento T3 para arrendamento,Apartamento,AVENIDAS NOVAS,LISBOA,LISBOA,105.0,2800
"Apartamento T3 com terraço e box para 3 carros - Canidelo, Gaia",Apartamento,CANIDELO,VILA NOVA DE GAIA,PORTO,152.0,2000
"Excelente Apartamento T2 na Alapraia, São João Do Estoril",Apartamento,CASCAIS,CASCAIS,LISBOA,55.0,1500
"Arrenda-se T2 mobilado, Constituição - Porto",Apartamento,PARANHOS,PORTO,PORTO,110.0,1350
"Arrendo Apartamento T.3 de Luxo em Stª Clara – Parceiros, Leiria.",Apartamento,PARCEIROS,PARCEIROS,LEIRIA,140.0,980
T1 em Telheiras Mobilado e Boa Area - Entrada Marzo,Apartamento,CARNIDE,LISBOA,LISBOA,70.0,1250
APARTAMENTO T2 – URB. MILHEIRAS – ZONA NORTE ALMEIRIM,Apartamento,ALMEIRIM,ALMEIRIM,SANTAREM,113.0,800
T1 para Arrendamento Ajuda,Apartamento,AJUDA,AJUDA,LISBOA,50.0,850
1º. andar de MORADIA,Moradia,CARVALHAL,SERTA,CASTELO BRANCO,55.0,500
Apartamento T1 para arrendamento,Apartamento,FARO,FARO ,FARO,50.14,750
Apartamento T2 para alugar,Apartamento,FATIMA,OUREM,SANTAREM,60.0,600
"Luminoso apartamento T2, em Miraflores, com vista para o Tejo",Apartamento,ALGES,OEIRAS,LISBOA,85.0,1950
Andar de moradia T3 remodelado com garagem e terraço,Moradia,RAMALDE,PORTO,PORTO,84.0,1600
Moradia T3 com espaço exterior. Pinheiro de Loures (Fonte Santa),Moradia,LOURES,LOURES,LISBOA,115.0,1800
Apartamento T3 para arrendar em Alvalade,Apartamento,ALVALADE,LISBOA,LISBOA,65.0,1800
Moradia T2 Batalha,Moradia,BATALHA,BATALHA,LEIRIA,80.0,500
Arrendar Apartamento Corroios,Apartamento,CORROIOS,SEIXAL,SETUBAL,90.0,1100
Apartamento T2 centro da Trofa,Apartamento,BOUGADO,TROFA,PORTO,80.0,600
T3 para alugar na Moita,Apartamento,SEIXAL,ARRENTELA,SETUBAL,110.0,1100
"T1 Renovado - Coração Histórico do Porto, Luz & Conforto",Apartamento,CEDOFEITA,PORTO,PORTO,50.0,1170
Arrendo Apartamento T1 Centro Torres Vedras,Apartamento,TORRES VEDRAS,SANTIAGO,LISBOA,43.0,500
Apartamento T6 na Lapa mobilado e equipado,Apartamento,ESTRELA,LISBOA,LISBOA,500.0,28000
Apartamento T5+1 para arrendar condomínio privado na Estrela,Apartamento,ESTRELA,LISBOA,LISBOA,636.34,28000
Moradia com vista total para o oceano atlântico,Moradia,OEIRAS,OEIRAS,LISBOA,293.0,25000
ARRENDAMENTO APARTAMENTO T3+1// COM 2 PARQUEAMENTOS//ARRECADAÇÃO,Apartamento,ALCABIDECHE,CASCAIS,LISBOA,157.0,3200
T3  Renovado | Suite | 2 WC | Varanda | Centro Histórico Cascais | Jun,Apartamento,CASCAIS,CASCAIS,LISBOA,85.0,2900
